{
  "schemaVersion": "1.0",
  "generationId": "rtg_minimal_fixture_0",
  "createdAt": "2026-01-01T00:00:00Z",
  "components": [
    {
      "name": "wine-core",
      "version": "9.0",
      "digest": "sha256:6666666666666666666666666666666666666666666666666666666666666666",
      "mediaType": "application/vnd.alloy.layer+zstd",
      "size": 1
    }
  ],
  "hostRequirements": {
    "architecture": "arm64",
    "minimumMacOS": "14.0"
  },
  "provenance": {
    "builderId": "builder-min",
    "sourceDigest": "src-digest-min",
    "buildRecipeDigest": "recipe-digest-min",
    "attestationDigest": "attestation-digest-min"
  }
}
